{
  "$schema": "https://json-schema.org/draft/2020-12/schema",
  "$id": "https://schemas.demand-radar.dev/review-envelope/1",
  "title": "ReviewEnvelope",
  "description": "An externally-authored, structured human review of one opportunity candidate, imported after analyst execution has already completed and been hashed. Independent means independent of analyst execution: not generated by the analyst provider, not a second same-provider critique, not produced by the worker agent that ran the trial. It is not a claim that the reviewer is an independent market or an independent research organization -- a reviewer who is the product owner must disclose that via reviewer.conflict, and such a review is still not market validation. The nested verdict reuses the existing CriticVerdict schema and fields unchanged.",
  "type": "object",
  "additionalProperties": false,
  "required": [
    "schema", "run_id", "opportunity_id", "reviewer", "reviewed_at",
    "opportunity_hash", "evidence_manifest_hash", "attestation", "verdict"
  ],
  "properties": {
    "schema": { "const": "demand-radar.review-envelope/1" },
    "run_id": { "type": "string", "minLength": 1, "maxLength": 120 },
    "opportunity_id": { "type": "string", "pattern": "^opp_[a-zA-Z0-9_-]+$" },
    "reviewer": {
      "type": "object",
      "additionalProperties": false,
      "required": ["kind", "id", "conflict"],
      "properties": {
        "kind": { "const": "human" },
        "id": {
          "type": "string",
          "minLength": 1,
          "maxLength": 120,
          "description": "A stable identifier for this reviewer that does not itself carry PII (e.g. a pseudonymous handle, not an email address)."
        },
        "conflict": {
          "type": "string",
          "minLength": 1,
          "maxLength": 120,
          "description": "Explicit conflict-of-interest disclosure, e.g. 'none' or 'product_owner'. Required on every review -- never silently omitted."
        }
      }
    },
    "reviewed_at": { "type": "string", "format": "date-time" },
    "opportunity_hash": {
      "type": "string",
      "pattern": "^sha256:[0-9a-f]{64}$",
      "description": "Hash of the OpportunityCard as exported. review import re-derives this from the current store and rejects the envelope if it no longer matches (stale or tampered)."
    },
    "evidence_manifest_hash": {
      "type": "string",
      "pattern": "^sha256:[0-9a-f]{64}$",
      "description": "Hash of the evidence.jsonl exported for this card. Re-derived and checked the same way as opportunity_hash."
    },
    "attestation": {
      "type": "object",
      "additionalProperties": false,
      "required": ["reviewed_primary_evidence", "review_not_generated_by_analyst_provider"],
      "properties": {
        "reviewed_primary_evidence": { "type": "boolean" },
        "review_not_generated_by_analyst_provider": { "type": "boolean" }
      }
    },
    "verdict": {
      "type": "object",
      "additionalProperties": false,
      "required": ["schema", "opportunity_id", "recommended_status", "objections", "overclaim_check", "notes"],
      "properties": {
        "schema": { "const": "demand-radar.critic-verdict/1" },
        "opportunity_id": { "type": "string", "pattern": "^opp_[a-zA-Z0-9_-]+$" },
        "recommended_status": {
          "type": "string",
          "enum": ["experiment_ready", "investigate", "rejected"],
          "description": "Non-authoritative. observed and externally_validated are not recommendable, human or model."
        },
        "objections": {
          "type": "array",
          "maxItems": 20,
          "items": {
            "type": "object",
            "additionalProperties": false,
            "required": ["code", "statement", "evidence_ids", "fatal"],
            "properties": {
              "code": {
                "type": "string",
                "enum": [
                  "complaint_not_purchase_intent",
                  "single_viral_source_dominant",
                  "duplicate_or_copied_content",
                  "audience_lacks_budget",
                  "free_substitute_sufficient",
                  "educational_not_commercial",
                  "removes_enjoyable_activity",
                  "required_input_unavailable",
                  "implementation_cost_dominates",
                  "evidence_supports_different_wedge",
                  "overclaims_evidence",
                  "other"
                ]
              },
              "statement": { "type": "string", "minLength": 1, "maxLength": 400 },
              "evidence_ids": {
                "type": "array",
                "uniqueItems": true,
                "items": { "type": "string", "pattern": "^ev_[a-zA-Z0-9_-]+$" },
                "description": "Must belong to the opportunity card under review -- review import rejects an objection evidence_id that exists but belongs to a different card."
              },
              "fatal": {
                "type": "boolean",
                "description": "True means this objection alone should block experiment_ready. The deterministic judge, not the reviewer, has final say."
              }
            }
          }
        },
        "overclaim_check": {
          "type": "object",
          "additionalProperties": false,
          "required": ["overclaims", "statement"],
          "properties": {
            "overclaims": { "type": "boolean" },
            "statement": { "type": "string", "maxLength": 400 }
          }
        },
        "notes": { "type": "string", "maxLength": 500 }
      }
    }
  }
}
