{
  "schema": "demand-radar.review-envelope/1",
  "run_id": "phase-2c-regen-001",
  "opportunity_id": "opp_caeaccf16eea",
  "reviewer": {
    "kind": "human",
    "id": "",
    "conflict": ""
  },
  "reviewed_at": "",
  "opportunity_hash": "sha256:6435cc2d90bc6fd932e0ee5a021dc3071d78ea011be5f0b107c3ed967888da26",
  "evidence_manifest_hash": "sha256:eaf65ede0f44fb58a0e5ff84ba40542db64bc0b1dcbaff62410fbd85ec6d2914",
  "attestation": {
    "reviewed_primary_evidence": false,
    "review_not_generated_by_analyst_provider": false
  },
  "verdict": {
    "schema": "demand-radar.critic-verdict/1",
    "opportunity_id": "opp_caeaccf16eea",
    "recommended_status": "investigate",
    "objections": [],
    "overclaim_check": {
      "overclaims": false,
      "statement": ""
    },
    "notes": ""
  }
}
