{
  "schema": "demand-radar.review-envelope/1",
  "run_id": "phase-2c-regen-001",
  "opportunity_id": "opp_457cf4b8f64a",
  "reviewer": {
    "kind": "human",
    "id": "",
    "conflict": ""
  },
  "reviewed_at": "",
  "opportunity_hash": "sha256:5418fe036b8e3f985f2e2993b26d98fa1e1198433cd841416b81f2011e4798e5",
  "evidence_manifest_hash": "sha256:1ef16469a065c890967177b3891855386d2b72e95b591ac7feada8b627c3c491",
  "attestation": {
    "reviewed_primary_evidence": false,
    "review_not_generated_by_analyst_provider": false
  },
  "verdict": {
    "schema": "demand-radar.critic-verdict/1",
    "opportunity_id": "opp_457cf4b8f64a",
    "recommended_status": "investigate",
    "objections": [],
    "overclaim_check": {
      "overclaims": false,
      "statement": ""
    },
    "notes": ""
  }
}
