{
  "schema": "demand-radar.review-envelope/1",
  "run_id": "phase-2c-regen-001",
  "opportunity_id": "opp_f5020f23972a",
  "reviewer": {
    "kind": "human",
    "id": "",
    "conflict": ""
  },
  "reviewed_at": "",
  "opportunity_hash": "sha256:4fc4574c7b396eaed91a8b0313a1283219d2713b472d9e885ec96567d2393ca9",
  "evidence_manifest_hash": "sha256:3057bb0fb1bf6c4ab112862ee3338ff4ff3208f76b76369000c7258dee7310f5",
  "attestation": {
    "reviewed_primary_evidence": false,
    "review_not_generated_by_analyst_provider": false
  },
  "verdict": {
    "schema": "demand-radar.critic-verdict/1",
    "opportunity_id": "opp_f5020f23972a",
    "recommended_status": "investigate",
    "objections": [],
    "overclaim_check": {
      "overclaims": false,
      "statement": ""
    },
    "notes": ""
  }
}
