{
  "schema": "demand-radar.review-envelope/1",
  "run_id": "phase-2c-regen-001",
  "opportunity_id": "opp_f646b47433da",
  "reviewer": {
    "kind": "human",
    "id": "",
    "conflict": ""
  },
  "reviewed_at": "",
  "opportunity_hash": "sha256:6ec0b3616d06a1971b405243f5a6181755cc6ef70f85f23c844e0eb55ba210c7",
  "evidence_manifest_hash": "sha256:e89bc6b71fb76e84012151c759378cb331f646b19f96b6e9d682f0b0e459af8f",
  "attestation": {
    "reviewed_primary_evidence": false,
    "review_not_generated_by_analyst_provider": false
  },
  "verdict": {
    "schema": "demand-radar.critic-verdict/1",
    "opportunity_id": "opp_f646b47433da",
    "recommended_status": "investigate",
    "objections": [],
    "overclaim_check": {
      "overclaims": false,
      "statement": ""
    },
    "notes": ""
  }
}
