{
  "schema": "demand-radar.review-envelope/1",
  "run_id": "phase-2c-regen-001",
  "opportunity_id": "opp_14c622fa4e94",
  "reviewer": {
    "kind": "human",
    "id": "",
    "conflict": ""
  },
  "reviewed_at": "",
  "opportunity_hash": "sha256:813703cb55c17e7c03bc0c6cd43c70728e7bdfbf85766a45153c5f22777a08c5",
  "evidence_manifest_hash": "sha256:61e69a5a2a1fee243770e6e9fc73750cfd0e6ea932b4d352620df7bbbced6f28",
  "attestation": {
    "reviewed_primary_evidence": false,
    "review_not_generated_by_analyst_provider": false
  },
  "verdict": {
    "schema": "demand-radar.critic-verdict/1",
    "opportunity_id": "opp_14c622fa4e94",
    "recommended_status": "investigate",
    "objections": [],
    "overclaim_check": {
      "overclaims": false,
      "statement": ""
    },
    "notes": ""
  }
}
