{
  "schema": "demand-radar.review-envelope/1",
  "run_id": "phase-2c-regen-001",
  "opportunity_id": "opp_7e7762f1c677",
  "reviewer": {
    "kind": "human",
    "id": "",
    "conflict": ""
  },
  "reviewed_at": "",
  "opportunity_hash": "sha256:104582697dbd466d73c290ddaeb8c0de8b14e858e6b0e5c8c134ce639a54f996",
  "evidence_manifest_hash": "sha256:f0ce98b5bdfce4d3f3057137236aec23eceda447d33b39654f2d51b8a39ca9f0",
  "attestation": {
    "reviewed_primary_evidence": false,
    "review_not_generated_by_analyst_provider": false
  },
  "verdict": {
    "schema": "demand-radar.critic-verdict/1",
    "opportunity_id": "opp_7e7762f1c677",
    "recommended_status": "investigate",
    "objections": [],
    "overclaim_check": {
      "overclaims": false,
      "statement": ""
    },
    "notes": ""
  }
}
