{
  "schema": "demand-radar.review-envelope/1",
  "run_id": "phase-2c-regen-001",
  "opportunity_id": "opp_19bf1cafaca4",
  "reviewer": {
    "kind": "human",
    "id": "",
    "conflict": ""
  },
  "reviewed_at": "",
  "opportunity_hash": "sha256:71700a1ee77b2b8fb72f6fbabecca3407b8f50f057353ecd4d5a942dc2750ed0",
  "evidence_manifest_hash": "sha256:01ed8aaf6e72f1e2d1de9dd737465ea5e31be9635e978544da5e970cf8ac1484",
  "attestation": {
    "reviewed_primary_evidence": false,
    "review_not_generated_by_analyst_provider": false
  },
  "verdict": {
    "schema": "demand-radar.critic-verdict/1",
    "opportunity_id": "opp_19bf1cafaca4",
    "recommended_status": "investigate",
    "objections": [],
    "overclaim_check": {
      "overclaims": false,
      "statement": ""
    },
    "notes": ""
  }
}
